{
  "schema_version": 1,
  "scope": "single-operator-authorized-lichess-canary",
  "experiment_only": true,
  "api_origin": "https://lichess.org",
  "transport_profile": "separate-live-gateway",
  "engine_release": "ONLINE-3A sealed HYBRID only",
  "variant": "standard",
  "initial_fen": "startpos",
  "rated": false,
  "clock_seconds": 600,
  "increment_seconds": 5,
  "opponent_username": null,
  "bot_account_username": null,
  "max_concurrent_games": 1,
  "max_new_games_per_session": 1,
  "outbound_challenges_allowed": false,
  "automatic_matchmaking_allowed": false,
  "external_move_sources_allowed": false,
  "chat_abort_resign_takeback_upgrade_allowed": false,
  "move_retries_allowed": false,
  "operator_armed": false,
  "operator_authorization_required": true,
  "production_publication_authorized": false,
  "live_game_authorized": false,
  "dependency_lock_approved": false,
  "legal_review_completed": false,
  "destination_host_qualified": false,
  "public_bot_release": false
}
